{
  "theme": "dark-teal",
  "site": {
    "name": "Agency Lite",
    "description": "A lightweight template for creative agencies.",
    "url": "https://example.com",
    "logo": "",
    "ogImage": "",
    "keywords": [
      "agency",
      "template",
      "portfolio",
      "creative"
    ],
    "locale": "en_US",
    "twitter": "@yourhandle",
    "whatsapp": "",
    "whatsappMessage": "",
    "colors": {
      "primary": "#000000",
      "secondary": "#ffffff"
    }
  },
  "hero": {
    "title": "We build digital experiences",
    "subtitle": "Creative solutions for modern brands.",
    "ctaText": "Get in touch",
    "backgroundImage": "https://i.imgur.com/nUrHXB2.png",
    "imageOpacity": 1,
    "opacity": 1,
    "link": ""
  },
  "about": {
    "title": "About Us",
    "text": "We are a team of passionate designers and developers building modern digital products. Our focus is on clean aesthetics and exceptional performance.",
    "opacity": 1,
    "link": ""
  },
  "servicesConfig": {
    "opacity": 1,
    "link": ""
  },
  "portfolioConfig": {
    "opacity": 1,
    "link": ""
  },
  "services": [
    {
      "title": "Web Development",
      "description": "Modern and fast websites.",
      "icon": "Code"
    },
    {
      "title": "Design",
      "description": "Beautiful user interfaces.",
      "icon": "Palette"
    },
    {
      "title": "Strategy",
      "description": "Digital product strategy.",
      "icon": "Lightbulb"
    }
  ],
  "contact": {
    "title": "Let's work together",
    "subtitle": "Have a project in mind? We'd love to hear about it.",
    "email": "hello@agencylite.com",
    "buttonText": "Send an email",
    "opacity": 1,
    "link": ""
  },
  "privacyPolicy": {
    "title": "Privacy Policy",
    "text": "Replace this starter text with a privacy policy reviewed for the contact details, analytics, cookies, embedded media, hosting, and other personal data or providers used by your agency before launch."
  },
  "termsOfService": {
    "title": "Terms of Service",
    "text": "Replace this starter text with terms reviewed for your agency, services, intellectual property, client engagement process, operating countries, and jurisdiction before launch."
  }
}
